{
  "event_score_id": "score_qualification_0001",
  "query_id": "q_trake_0001",
  "event_id": "event_2",
  "video_id": "video_test_0001",
  "event_window_id": "window_2",
  "original_frame_id": 430,
  "score": 0.93,
  "score_type": "state_transition",
  "producer": "transition-scorer:v1",
  "model_version": "pose-v1",
  "evidence_ids": ["ev_event_2"],
  "computed_at": "2026-08-10T08:00:04Z"
}
